{
	"generated_by": "scripts/seed_material_rendering_profiles.py",
	"note": "DURABLE Law-1 owner of PROFILE colors/shade. RQ-154 broad live profile set: terrain:1 GRASS is the frozen live thin slice; other non-WATER materials seeded from their own renderable (<=671) v2 candidates. >671 candidates deferred to RQ-153c.",
	"profiles": [{
			"profile_state": "live",
			"colors": {
				"bg_palette": [],
				"fallback_bytes": {
					"ramp:fall_lower": 44,
					"ramp:flat_low": 44,
					"ramp:high": 44,
					"ramp:rise": 44
				},
				"fg_palette": [],
				"per_row": [{
						"fg_strength": 210,
						"bg_strength": 150,
						"shade_contrast": 6
					}, {
						"fg_strength": 210,
						"bg_strength": 150,
						"shade_contrast": 6
					}, {
						"fg_strength": 210,
						"bg_strength": 150,
						"shade_contrast": 6
					}, {
						"fg_strength": 210,
						"bg_strength": 150,
						"shade_contrast": 6
					}],
				"shade_band_thresholds": [3, 7, 11, 12],
				"elevation_rows": {
					"fall_lower": {
						"fg": [223, 142, 140],
						"bg": [105, 24, 22]
					},
					"high": {
						"fg": [255, 184, 180],
						"bg": [255, 66, 62]
					},
					"rise": {
						"fg": [255, 159, 156],
						"bg": [180, 41, 38]
					},
					"flat_low": {
						"fg": [255, 168, 165],
						"bg": [220, 50, 47]
					}
				}
			},
			"display_name": "Grass Tops",
			"glyph_pools": {
				"glyph_ids": [512, 513, 514, 515, 516, 517, 518, 519, 520, 521, 522, 523, 524, 525, 526, 527, 528, 529, 530, 531, 532, 533, 534, 535, 536, 537, 538, 539, 540, 541, 542, 543, 544, 545, 546, 547, 548, 549, 550, 551, 552, 553, 554, 555, 556, 557, 558, 559, 560, 561, 562, 563, 564, 565, 566, 567, 568, 569, 570, 571, 572, 573, 574, 575, 576, 577, 578, 579, 580, 581, 582, 583, 584, 585, 586, 587, 588, 589, 590, 591, 592, 593, 594, 595, 596, 597, 598, 599, 600, 601, 602, 603, 604, 605, 606, 607, 608, 609, 610, 611, 612, 613, 614, 615, 616, 617, 618, 619, 620, 621, 622, 623, 624, 625, 626, 627, 628, 629, 630, 631, 632, 633, 634, 635, 636, 637, 638, 639]
			},
			"idempotency_marker": "fl4260-rq147-grass-tops-0001",
			"material_id": "terrain:1",
			"no_match_policy": {
				"structural_degenerate_declines": true,
				"structural_decline_fallback": "tonal",
				"tonal_constant_operand_legal": true,
				"max_error_q": {
					"structural": 700000,
					"tonal": 700000
				}
			},
			"preset_seed_id": "grass_tops",
			"review_receipt_id": null,
			"role_buckets": {
				"accent": [{
						"reviewed": false,
						"candidates": [],
						"frequency": 0,
						"reject": "accent lane disabled in first slice",
						"seed": 0
					}],
				"density": [{
						"reviewed": false,
						"bucket": "D0",
						"fallback": 46,
						"reject": null,
						"candidates": [512, 513, 514, 515, 528, 529, 530, 531, 544, 545, 546, 547, 560, 561, 562, 563]
					}, {
						"reviewed": false,
						"bucket": "D1",
						"fallback": 44,
						"reject": null,
						"candidates": [516, 517, 518, 519, 532, 533, 534, 535, 548, 549, 550, 551, 564, 565, 566, 567]
					}, {
						"reviewed": false,
						"bucket": "D2",
						"fallback": 58,
						"reject": null,
						"candidates": [520, 521, 522, 523, 536, 537, 538, 539, 552, 553, 554, 555, 568, 569, 570, 571]
					}, {
						"reviewed": false,
						"bucket": "D3",
						"fallback": 59,
						"reject": null,
						"candidates": [524, 525, 526, 527, 540, 541, 542, 543, 556, 557, 558, 559, 572, 573, 574, 575]
					}],
				"ramp": [{
						"reviewed": false,
						"elevation_row": "fall_lower",
						"elv": 0,
						"fallback": 46,
						"reject": null,
						"candidates": [512, 516, 520, 524, 528, 532, 536, 540, 544, 548, 552, 556, 560, 564, 568, 572]
					}, {
						"reviewed": false,
						"elevation_row": "high",
						"elv": 1,
						"fallback": 44,
						"reject": null,
						"candidates": [513, 517, 521, 525, 529, 533, 537, 541, 545, 549, 553, 557, 561, 565, 569, 573]
					}, {
						"reviewed": false,
						"elevation_row": "rise",
						"elv": 2,
						"fallback": 58,
						"reject": null,
						"candidates": [514, 518, 522, 526, 530, 534, 538, 542, 546, 550, 554, 558, 562, 566, 570, 574]
					}, {
						"reviewed": false,
						"elevation_row": "flat_low",
						"elv": 3,
						"fallback": 59,
						"reject": null,
						"candidates": [515, 519, 523, 527, 531, 535, 539, 543, 547, 551, 555, 559, 563, 567, 571, 575]
					}],
				"edge": [{
						"fact": "flat",
						"reviewed": false,
						"candidates": [556, 559, 560, 561, 562, 563, 600, 601, 604, 605, 612, 613]
					}, {
						"fact": "rise",
						"reviewed": false,
						"candidates": [556, 559, 560, 561, 562, 563, 571, 572, 573, 574, 579, 581, 600, 601, 604, 605]
					}, {
						"fact": "fall",
						"reviewed": false,
						"candidates": [556, 559, 560, 561, 562, 563, 571, 572, 573, 574, 579, 581, 600, 601, 604, 605]
					}, {
						"fact": "ridge",
						"reviewed": false,
						"candidates": [556, 559, 560, 561, 562, 563, 571, 572, 573, 574, 579, 581, 600, 601, 604, 605]
					}, {
						"fact": "valley",
						"reviewed": false,
						"candidates": [556, 559, 560, 561, 562, 563, 571, 572, 573, 574, 579, 581, 600, 601, 604, 605]
					}, {
						"fact": "wall",
						"reviewed": false,
						"candidates": [556, 559, 560, 561, 562, 563, 571, 572, 573, 574, 579, 581, 600, 601, 604, 605]
					}, {
						"fact": "overhang",
						"reviewed": false,
						"candidates": [],
						"blocked": "not exposed in Material Look until source-fact proof exists"
					}],
				"direction": [{
						"fact": "north",
						"reviewed": false,
						"candidates": []
					}, {
						"fact": "north_east",
						"reviewed": false,
						"candidates": []
					}, {
						"fact": "east",
						"reviewed": false,
						"candidates": []
					}, {
						"fact": "south_east",
						"reviewed": false,
						"candidates": []
					}, {
						"fact": "south",
						"reviewed": false,
						"candidates": []
					}, {
						"fact": "south_west",
						"reviewed": false,
						"candidates": []
					}, {
						"fact": "west",
						"reviewed": false,
						"candidates": []
					}, {
						"fact": "north_west",
						"reviewed": false,
						"candidates": []
					}],
				"flow": [{
						"fact": "north",
						"reviewed": false,
						"candidates": [],
						"blocked": "not exposed in Material Look until flow source-fact proof exists"
					}, {
						"fact": "north_east",
						"reviewed": false,
						"candidates": [],
						"blocked": "not exposed in Material Look until flow source-fact proof exists"
					}, {
						"fact": "east",
						"reviewed": false,
						"candidates": [],
						"blocked": "not exposed in Material Look until flow source-fact proof exists"
					}, {
						"fact": "south_east",
						"reviewed": false,
						"candidates": [],
						"blocked": "not exposed in Material Look until flow source-fact proof exists"
					}, {
						"fact": "south",
						"reviewed": false,
						"candidates": [],
						"blocked": "not exposed in Material Look until flow source-fact proof exists"
					}, {
						"fact": "south_west",
						"reviewed": false,
						"candidates": [],
						"blocked": "not exposed in Material Look until flow source-fact proof exists"
					}, {
						"fact": "west",
						"reviewed": false,
						"candidates": [],
						"blocked": "not exposed in Material Look until flow source-fact proof exists"
					}, {
						"fact": "north_west",
						"reviewed": false,
						"candidates": [],
						"blocked": "not exposed in Material Look until flow source-fact proof exists"
					}],
				"mesh_bundle": {
					"role": "mesh_feature",
					"route_key": "mesh_feature.bundle.v1",
					"lane_id": 0,
					"lane_name": "mesh_bundle",
					"descriptor_version": "mesh_projected_feature.v1"
				}
			},
			"runtime_profile_live": true,
			"scoring": {
				"detail_contrast": 50,
				"tone_contrast": 50,
				"density_bias": 0,
				"role_weights": {
					"curve": 1,
					"diagonal": 1,
					"horizontal": 1,
					"vertical": 1,
					"sparse": 1,
					"dense": 1
				}
			},
			"seed_provenance": "e0e199c7387b8de21f509432f1e9ab6c145ecade9261f4abec0db10fb8e6d52e",
			"source_class": "terrain",
			"source_table_hash": "e0e199c7387b8de21f509432f1e9ab6c145ecade9261f4abec0db10fb8e6d52e"
		}, {
			"profile_state": "live",
			"colors": {
				"bg_palette": [],
				"fallback_bytes": {
					"ramp:fall_lower": 44,
					"ramp:flat_low": 44,
					"ramp:high": 44,
					"ramp:rise": 44
				},
				"fg_palette": [],
				"per_row": [{
						"fg_strength": 210,
						"bg_strength": 150,
						"shade_contrast": 6
					}, {
						"fg_strength": 210,
						"bg_strength": 150,
						"shade_contrast": 6
					}, {
						"fg_strength": 210,
						"bg_strength": 150,
						"shade_contrast": 6
					}, {
						"fg_strength": 210,
						"bg_strength": 150,
						"shade_contrast": 6
					}],
				"shade_band_thresholds": [3, 7, 11, 12],
				"elevation_rows": {
					"fall_lower": {
						"fg": [234, 184, 198],
						"bg": [116, 66, 80]
					},
					"high": {
						"fg": [183, 111, 149],
						"bg": [255, 183, 221]
					},
					"rise": {
						"fg": [127, 41, 65],
						"bg": [199, 113, 137]
					},
					"flat_low": {
						"fg": [171, 67, 96],
						"bg": [243, 139, 168]
					}
				}
			},
			"display_name": "Dirt",
			"glyph_pools": {
				"glyph_ids": [521, 523, 524, 525, 526, 532, 533, 534, 535, 539, 541, 546, 548, 549, 550, 551, 555, 556, 557, 558, 559, 560, 561, 562, 563, 564, 568, 569, 570, 571, 572, 573, 574, 575, 576, 580, 583, 584, 585, 586, 587, 588, 598, 599, 600, 601, 602, 603, 604, 605, 606, 607, 608, 609, 610, 611, 612, 613, 614, 615, 616, 618, 619, 620, 621, 622, 624, 625, 626, 627, 628, 629, 630, 631, 632, 633, 634, 636, 637, 638, 639, 641, 643, 646, 648, 649, 650, 653, 656, 658, 659, 660, 662, 663, 666, 668, 669, 671, 32, 46, 58, 64, 79, 111]
			},
			"idempotency_marker": "fl4260-rq154-dirt-0001",
			"material_id": "terrain:2",
			"no_match_policy": {
				"structural_degenerate_declines": true,
				"structural_decline_fallback": "tonal",